name,location,price,capacity,rating,reviews,description
South Elm Events,"Commerce, GA",$$,101-150 Guests,5,3,"South Elm Events: Weave Your Fairytale Wedding Imagine your dream wedding: a breathtaking ceremony bathed in sunlight, an elegant reception filled with laughter."
The Farm at Ashley Ridge,"Cleveland, GA",$$,151-200 Guests,5,12,"The Farm at Ashley Ridge is a serene countryside wedding venue located in Cleveland, GA."
McEachin Farm,"Danielsville, GA",$$,101-150 Guests,5,2,"McEachin Farm is a stunning wedding venue in Atlanta, GA, that sets the stage for the celebration of a lifetime!"
Enotah Valley Event Center,"Blairsville, GA",$$,51-100 Guests,5,5,"Enotah Valley Event Center is a rustic setting for weddings located in Blairsville, GA."
Butler Hall Events,"Gray, GA",$$,201-250 Guests,5,1,"Butler Hall Events is a historic wedding venue in Gray, Georgia, originally a large car garage, lovingly restored to create a modern event facility."
Walnut Hill Farm,"Dalton, GA",$$,300+ Guests,4.8,16,"Walnut Hill Farm offers classic Southern elegance in the North Georgia Mountains with majestic mountain views, formal and informal gardens, orchards, and a beautifully landscaped pond."
Overlook 55,"Young Harris, GA",$$$$,151-200 Guests,5,7,"Overlook 55 is a captivating wedding venue that seamlessly blends rustic charm with timeless elegance in Young Harris, GA."
Brasstown Valley Resort & Spa,"Young Harris, GA",$$$,151-200 Guests,4.9,79,"Brasstown Valley Resort & Spa in Young Harris, GA, offers breathtaking mountain views, unique venues, an 18-hole championship golf course, and a full-service spa."
The Barn at Young Harris,"Young Harris, GA",$$$,151-200 Guests,5,42,The Barn at Young Harris is a dream setting for couples looking for a rustic wedding with breathtaking panoramic views of Brasstown Bald Mountain.
Bend of The River,"Hiawassee, GA",$$,300+ Guests,0,0,"Bend of the River is a gorgeous, tranquil wedding venue on Lake Chatuge in Hiawassee, Georgia, offering natural beauty with a 100-foot waterfall."
The Ridges Resort on Lake Chatuge,"Hiawassee, GA",$$$,201-250 Guests,4.9,46,"The Ridges Resort on Lake Chatuge is a lakeside mountain resort in Georgia, surrounded by the Blue Ridge Mountains with a grand ballroom."
The Estate at Stone Creek,"Macon, GA",$$,201-250 Guests,4.8,5,"The Estate at Stone Creek offers a historic setting on over 100 acres of beautiful landscape in Macon, GA."
Rustic Vows,"Mineral Bluff, GA",$$,51-100 Guests,0,0,"Rustic Vows offers an idyllic barn-style setting for weddings in Mineral Bluff, GA."
Lake Rabun Hotel & Restaurant,"Lakemont, GA",$$,101-150 Guests,5,2,"Lake Rabun Hotel & Restaurant features two covered, open-air decks and a cozy indoor gas fireplace for intimate wedding celebrations."
Currahee Club,"Toccoa, GA",$$$,101-150 Guests,5,10,"Currahee Club offers serene lake and mountain views with a blend of sophistication and rustic charm in Toccoa, GA."
Meadows at Mossy Creek,"Cleveland, GA",$$$$,251-300 Guests,5,39,"Meadows at Mossy Creek is a stylish and contemporary wedding venue with indoor and outdoor spaces in Cleveland, GA."
Hawkesdene,"Andrews, NC",$$$,101-150 Guests,5,58,"Hawkesdene is a Private Mountain Estate located in Andrews, NC, offering a unique wedding setting in the mountains of Western North Carolina."
The Dogwood Barn at G5Ranch,"Milledgeville, GA",$$$,300+ Guests,5,16,"The Dogwood Barn at G5Ranch is a premier wedding venue on over 600 acres in Milledgeville, GA, ideal for rustic romantic events."
Tryphena's Garden,"Fort Valley, GA",$$,151-200 Guests,4.9,18,"Tryphena's Garden is a fairytale-like wedding venue near Atlanta and Macon, offering convenience and comfort in Fort Valley, GA."
Cloudland at McLemore Resort,"Rising Fawn, GA",$$$,251-300 Guests,4.2,6,"Cloudland at McLemore Resort on Lookout Mountain offers breathtaking views and magical wedding settings at 2,300 feet above sea level."
Tiger Mountain Vineyards,"Tiger, GA",$$$,101-150 Guests,5,1,"Tiger Mountain Vineyards offers a charming and intimate setting for outdoor weddings with a romantic vineyard backdrop in Tiger, GA."
Skull Shoals Park,"Washington, GA",$$,300+ Guests,0,0,"Skull Shoals Park is a 68-acre outdoor venue located in Historic Washington, GA, ideal for couples who want to be surrounded by nature on their wedding day."
Windsong Willows,"Hayesville, NC",$$,101-150 Guests,5,3,"Windsong Willows is a charming new wedding venue in Hayesville, NC, designed for couples seeking an authentic nature-based wedding experience."
Forest Hill Park,"Perry, GA",$$,51-100 Guests,4.9,21,"Forest Hill Park offers a picturesque 1920's white wedding chapel, a red train car for getting dressed, and beautiful picture opportunities in Perry, GA."
Kingsland Farm,"Hawkinsville, GA",$$,151-200 Guests,5,1,A picturesque and reclusive wedding venue surrounded by calm rural beauty.
The Icehouse Dublin,"Dublin, GA",$$,300+ Guests,0,0,A unique wedding venue that blends Southern style with urban and modern flair.
The Partridge Inn,"Augusta, GA",$$$,101-150 Guests,3.7,3,"An elegant, timelessly beautiful setting for milestone celebrations."
Padgett's Farm,"Waynesboro, GA",$$,251-300 Guests,5,1,A gem of a wedding venue nestled on 610 acres of breathtaking nature.
Augusta Marriott Hotel & Suites,"Augusta, GA",$$,300+ Guests,4.3,6,A meticulously redesigned hotel on the Savannah River waterfront.
Quinney Oaks Plantation,"Millen, GA",$$,300+ Guests,4.8,18,A wedding venue that can make every occasion feel special.
